<?xml version="1.0" encoding="UTF-8"?>
<re:resenje xmlns:vc="http://www.w3.org/2007/XMLSchema-versioning"
 xmlns:re="resenje"
 xmlns:xsi="http://www.w3.org/2001/XMLSchema-instance"
 xsi:schemaLocation="resenje file:/C:/FAKS/7%20semestar/XML%20veb%20serivisi/xml-projekat/documents/schemas/resenje.xsd">
    <re:BrojResenja>000-00-0000/0000-00</re:BrojResenja>
    <re:DatumResenja>2006-05-04</re:DatumResenja>
    <re:Uvod>
        <re:DatumZalbe>2006-05-04</re:DatumZalbe>
        <re:OrganVlasti>OrganVlasti0</re:OrganVlasti>
    </re:Uvod>
    <re:Sadrzaj>
        <re:OrganVlasti>OrganVlasti1</re:OrganVlasti>
        <re:Ishod>Ishod0</re:Ishod>
    </re:Sadrzaj>
    <re:Obrazlozenje>
        <re:Paragraf1>
            <re:DatumIzjave>2006-05-04</re:DatumIzjave>
            <re:OrganVlasti>OrganVlasti2</re:OrganVlasti>
            <re:DatumPotrazivanjaInformacija>2006-05-04</re:DatumPotrazivanjaInformacija>
        </re:Paragraf1>
    </re:Obrazlozenje>
    <re:Poverenik>
        <re:Ime>Ime0</re:Ime>
        <re:Prezime>Prezime0</re:Prezime>
    </re:Poverenik>
</re:resenje>
